[
  {
    "id": 1,
    "name": "Argeon Highmayne",
    "faction": "Lyonar",
    "cost": 0,
    "cardType": "general",
    "atk": 2,
    "hp": 25,
    "rarity": "",
    "race": "",
    "set": "Core",
    "resourceIds": [
      "f1GeneralAttack",
      "f1GeneralBreathing",
      "f1GeneralCast",
      "f1GeneralCastEnd",
      "f1GeneralCastLoop",
      "f1GeneralCastStart",
      "f1GeneralDamage",
      "f1GeneralDeath",
      "f1GeneralIdle",
      "f1GeneralRun",
      "general_f1",
      "general_portrait_image_f1",
      "general_portrait_image_hex_f1",
      "sfx_announcer_lyonar_1st",
      "sfx_announcer_lyonar_2nd",
      "sfx_f1_general_attack_swing",
      "sfx_f1_general_hit",
      "sfx_f1general_death",
      "sfx_f6_draugarlord_attack_impact",
      "sfx_unit_deploy",
      "sfx_unit_run_charge_4",
      "speech_portrait_lyonar_side"
    ],
    "description": "Bloodbound Spell: Give a friendly minion nearby your General +2 Attack."
  },
  {
    "id": 8,
    "name": "Lysian Brawler",
    "faction": "Lyonar",
    "cost": 4,
    "cardType": "unit",
    "atk": 4,
    "hp": 4,
    "rarity": "Fixed",
    "race": "",
    "set": "Core",
    "resourceIds": [
      "f1SilvermaneVanguardAttack",
      "f1SilvermaneVanguardBreathing",
      "f1SilvermaneVanguardDamage",
      "f1SilvermaneVanguardDeath",
      "f1SilvermaneVanguardIdle",
      "f1SilvermaneVanguardRun",
      "sfx_f1lysianbrawler_attack_impact",
      "sfx_f1lysianbrawler_attack_swing",
      "sfx_f1lysianbrawler_death",
      "sfx_f1lysianbrawler_hit",
      "sfx_singe2",
      "sfx_spell_immolation_b"
    ],
    "description": "Celerity"
  },
  {
    "id": 9,
    "name": "Windblade Adept",
    "faction": "Lyonar",
    "cost": 2,
    "cardType": "unit",
    "atk": 2,
    "hp": 3,
    "rarity": "Fixed",
    "race": "",
    "set": "Core",
    "resourceIds": [
      "f1MeleeAttack",
      "f1MeleeBreathing",
      "f1MeleeDamage",
      "f1MeleeDeath",
      "f1MeleeIdle",
      "f1MeleeRun",
      "sfx_f2melee_attack_impact",
      "sfx_f2melee_attack_swing",
      "sfx_f2melee_death",
      "sfx_f2melee_hit",
      "sfx_singe2",
      "sfx_spell_immolation_b"
    ],
    "description": "Zeal: Gains +1 Attack"
  },
  {
    "id": 10,
    "name": "Sunstone Templar",
    "faction": "Lyonar",
    "cost": 2,
    "cardType": "unit",
    "atk": 1,
    "hp": 4,
    "rarity": "Epic",
    "race": "",
    "set": "Core",
    "resourceIds": [
      "f1SunstoneTemplarAttack",
      "f1SunstoneTemplarBreathing",
      "f1SunstoneTemplarDamage",
      "f1SunstoneTemplarDeath",
      "f1SunstoneTemplarIdle",
      "f1SunstoneTemplarRun",
      "sfx_f2stormkage_attack_impact",
      "sfx_f2stormkage_attack_swing",
      "sfx_f2stormkage_death",
      "sfx_f2stormkage_hit",
      "sfx_singe2",
      "sfx_ui_booster_packexplode"
    ],
    "description": "Whenever this attacks or counterattacks, it dispels that enemy"
  },
  {
    "id": 11,
    "name": "Silverguard Knight",
    "faction": "Lyonar",
    "cost": 3,
    "cardType": "unit",
    "atk": 1,
    "hp": 5,
    "rarity": "Fixed",
    "race": "",
    "set": "Core",
    "resourceIds": [
      "f1TankAttack",
      "f1TankBreathing",
      "f1TankDamage",
      "f1TankDeath",
      "f1TankIdle",
      "f1TankRun",
      "sfx_f1tank_attack_impact",
      "sfx_f1tank_attack_swing",
      "sfx_f1tank_death",
      "sfx_f1tank_hit",
      "sfx_spell_immolation_b",
      "sfx_unit_run_charge_4"
    ],
    "description": "Provoke\nZeal: Gains +2 Attack"
  },
  {
    "id": 12,
    "name": "Arclyte Sentinel",
    "faction": "Lyonar",
    "cost": 3,
    "cardType": "unit",
    "atk": 2,
    "hp": 4,
    "rarity": "Rare",
    "race": "",
    "set": "Core",
    "resourceIds": [
      "f1SpecialAttack",
      "f1SpecialBreathing",
      "f1SpecialDamage",
      "f1SpecialDeath",
      "f1SpecialIdle",
      "f1SpecialRun",
      "sfx_f2stormkage_attack_impact",
      "sfx_f2stormkage_attack_swing",
      "sfx_f2stormkage_death",
      "sfx_f2stormkage_hit",
      "sfx_spell_immolation_b",
      "sfx_unit_run_charge_4"
    ],
    "description": "Opening Gambit: Give ANY nearby minion +2 Attack, but -2 Health"
  },
  {
    "id": 13,
    "name": "Second Sun",
    "faction": "Lyonar",
    "cost": 5,
    "cardType": "unit",
    "atk": 0,
    "hp": 8,
    "rarity": "Rare",
    "race": "",
    "set": "Core",
    "resourceIds": [
      "f1WindbladeCommanderAttack",
      "f1WindbladeCommanderBreathing",
      "f1WindbladeCommanderDamage",
      "f1WindbladeCommanderDeath",
      "f1WindbladeCommanderIdle",
      "f1WindbladeCommanderRun",
      "sfx_f1windbladecommander_attack_swing",
      "sfx_f1windbladecommander_death",
      "sfx_f1windbladecommander_hit",
      "sfx_f1windbladecommanderattack_impact",
      "sfx_singe2",
      "sfx_spell_immolation_b"
    ],
    "description": "Zeal: Gains +8 Attack"
  },
  {
    "id": 14,
    "name": "Silverguard Squire",
    "faction": "Lyonar",
    "cost": 1,
    "cardType": "unit",
    "atk": 1,
    "hp": 4,
    "rarity": "Common",
    "race": "",
    "set": "Core",
    "resourceIds": [
      "f1SilverguardSquireAttack",
      "f1SilverguardSquireBreathing",
      "f1SilverguardSquireDamage",
      "f1SilverguardSquireDeath",
      "f1SilverguardSquireIdle",
      "f1SilverguardSquireRun",
      "sfx_f1silverguardsquire_attack_impact",
      "sfx_f1silverguardsquire_attack_swing",
      "sfx_f1silverguardsquire_death",
      "sfx_f1silverguardsquire_hit",
      "sfx_singe2",
      "sfx_spell_immolation_b"
    ],
    "description": ""
  },
  {
    "id": 15,
    "name": "Lightchaser",
    "faction": "Lyonar",
    "cost": 2,
    "cardType": "unit",
    "atk": 3,
    "hp": 2,
    "rarity": "Common",
    "race": "",
    "set": "Core",
    "resourceIds": [
      "f1CasterAttack",
      "f1CasterBreathing",
      "f1CasterDamage",
      "f1CasterDeath",
      "f1CasterIdle",
      "f1CasterRun",
      "sfx_f1lysianbrawler_attack_impact",
      "sfx_f1lysianbrawler_hit",
      "sfx_f1silverguardsquire_death",
      "sfx_spell_immolation_b",
      "sfx_spell_lastingjudgement",
      "sfx_unit_run_charge_4"
    ],
    "description": "Whenever anything is healed, this minion gains +1/+1."
  },
  {
    "id": 16,
    "name": "Suntide Maiden",
    "faction": "Lyonar",
    "cost": 4,
    "cardType": "unit",
    "atk": 3,
    "hp": 6,
    "rarity": "Common",
    "race": "",
    "set": "Core",
    "resourceIds": [
      "f1SupportAttack",
      "f1SupportBreathing",
      "f1SupportDamage",
      "f1SupportDeath",
      "f1SupportIdle",
      "f1SupportRun",
      "sfx_neutral_gambitgirl_attack_swing",
      "sfx_neutral_jaxtruesight_death",
      "sfx_neutral_luxignis_hit",
      "sfx_neutral_pandora_death",
      "sfx_spell_immolation_b",
      "sfx_unit_run_magical_4"
    ],
    "description": "Zeal: At the end of your turn, fully heal this minion."
  },
  {
    "id": 17,
    "name": "Ironcliffe Guardian",
    "faction": "Lyonar",
    "cost": 5,
    "cardType": "unit",
    "atk": 3,
    "hp": 10,
    "rarity": "Rare",
    "race": "",
    "set": "Core",
    "resourceIds": [
      "f1IroncliffeGuardianAttack",
      "f1IroncliffeGuardianBreathing",
      "f1IroncliffeGuardianDamage",
      "f1IroncliffeGuardianDeath",
      "f1IroncliffeGuardianIdle",
      "f1IroncliffeGuardianRun",
      "sfx_f1ironcliffeguardian_attack_impact",
      "sfx_f1ironcliffeguardian_attack_swing",
      "sfx_f1ironcliffeguardian_death",
      "sfx_f1ironcliffeguardian_hit",
      "sfx_spell_immolation_b",
      "sfx_unit_run_charge_4"
    ],
    "description": "Airdrop\nProvoke"
  },
  {
    "id": 18,
    "name": "Elyx Stormblade",
    "faction": "Lyonar",
    "cost": 6,
    "cardType": "unit",
    "atk": 7,
    "hp": 7,
    "rarity": "Legendary",
    "race": "",
    "set": "Core",
    "resourceIds": [
      "f1ElyxStormbladeAttack",
      "f1ElyxStormbladeBreathing",
      "f1ElyxStormbladeDamage",
      "f1ElyxStormbladeDeath",
      "f1ElyxStormbladeIdle",
      "f1ElyxStormbladeRun",
      "sfx_f1elyxstormblade_attack_impact",
      "sfx_f1elyxstormblade_attack_swing",
      "sfx_f1elyxstormblade_death",
      "sfx_f1elyxstormblade_hit",
      "sfx_singe2",
      "sfx_summonlegendary"
    ],
    "description": "Provoke\nYour minions and General may move an additional space"
  },
  {
    "id": 20,
    "name": "Grandmaster Z'ir",
    "faction": "Lyonar",
    "cost": 7,
    "cardType": "unit",
    "atk": 5,
    "hp": 12,
    "rarity": "Legendary",
    "race": "",
    "set": "Core",
    "resourceIds": [
      "f1GrandmasterZirAttack",
      "f1GrandmasterZirBreathing",
      "f1GrandmasterZirDamage",
      "f1GrandmasterZirDeath",
      "f1GrandmasterZirIdle",
      "f1GrandmasterZirRun",
      "sfx_f1_grandmasterzir_attack_impact",
      "sfx_f1_grandmasterzir_attack_swing",
      "sfx_f1_grandmasterzir_death",
      "sfx_f1_grandmasterzir_hit",
      "sfx_singe2",
      "sfx_summonlegendary"
    ],
    "description": "When your General dies, Grandmaster Z'ir becomes your General."
  },
  {
    "id": 21,
    "name": "Azurite Lion",
    "faction": "Lyonar",
    "cost": 2,
    "cardType": "unit",
    "atk": 2,
    "hp": 3,
    "rarity": "Common",
    "race": "",
    "set": "Core",
    "resourceIds": [
      "f1AzuriteLionAttack",
      "f1AzuriteLionBreathing",
      "f1AzuriteLionDamage",
      "f1AzuriteLionDeath",
      "f1AzuriteLionIdle",
      "f1AzuriteLionRun",
      "sfx_neutral_arakiheadhunter_hit",
      "sfx_neutral_beastsaberspinetiger_attack_impact",
      "sfx_neutral_beastsaberspinetiger_attack_swing",
      "sfx_neutral_beastsaberspinetiger_death",
      "sfx_neutral_beastsaberspinetiger_hit",
      "sfx_spell_diretidefrenzy"
    ],
    "description": "Celerity"
  },
  {
    "id": 22,
    "name": "Sunriser",
    "faction": "Lyonar",
    "cost": 4,
    "cardType": "unit",
    "atk": 3,
    "hp": 4,
    "rarity": "Epic",
    "race": "",
    "set": "Core",
    "resourceIds": [
      "f1SunriserAttack",